Nephrolithiasis ,both,common,None or Hematuria,Vomiting,Dysuria,renal failure,lower urinary tract,Vomiting,,,,,,,,,
Anemia - Heinz Body,both,common,occasionally icteric mucous membranes,Dark-colored blood,Tachypnea,Tachycardia,Exposure to oxidant,Weakness,Lethargy,Anorexia,Reddish-brown urine,,,,,,
Encephalitis Secondary to Parasitic Migration,both,five,Depression,Staggering,Walking around in circles,Head tilting,Head pressing,Loss of muscle movement in the face,Dizziness,Weakness,,,,,,,
Hypomagnesemia,both,common,Weakness,Muscle trembling,Ataxia,Depression,Hyperreflexia,Severe muscle pain,Behavioral changes,Arrhythmias,,,,,,,
Atrioventricular Valvular Stenosis,both,ten,Exercise intolerance,Syncope,Tachypnea,Coughing,Cyanosis,Abdominal distention,arterial thromboembolism,Stunted growth,Hemoptysis from rupture,,,,,,
Hepatitis-Infectious Canine,both,five,Lack of appetite,Fever,Lethargy,Vomiting,Diarrhea,Hepatomegaly,Abdominal pain,Runny eyes and nose,Coughing,Excessively thirsty,,,,,
Vertebral Column Trauma ,both,common,ataxia,Clinical signs suggestive of hyperesthesia,Lethargy,Pulmonary contusions and rib fractures,Pelvic and appendicular bone fractures,Cutaneous wounds,Traumatic brain injury,Abdominal organ injury,,,,,,,
Ethanol Toxicosis,both,common,Lethargy,Sedation,Depression,Ataxia,Vomiting,Diarrhea,Disorientation,Depression,Vocalization,Coma,Seizures,,,,
Immunodeficiency Disorders-Primary,male,five,Diarrhea,Lethargy,Weakness,Loss of Appetite,Lesions,Pain within the joints,Lameness,Anemia,Recurrent illnesses,Vomiting,Seizures,,,,
Hyponatremia,both,common,Lack of energy,Vomiting,Seizures,Less alert,Disorientation,Loss of Appetite,Lowered muscle strength,,,,,,,,
Disseminated Intravascular Coagulation,both,common,Excessive sleepiness,Weakness,red spots from Bleeding into the skin,Bruising,Pale gums and other mucous membranes,Jaundice,yellowing of skin,Bloody,Vomiting,Bloody,Rapid heart rate and respirations,Swelling,,,
Dermatoses-Sun Induced,both,common,Dry skin,Fibrosis,Folliculitis,Lesions,Pain,Redness,Crusty,Scaling,Tumors,Wrinkles,,,,,
Notoedric Mange ,both,common,Non-seasonal intense Pruritus,initial Pruritus,Change from mild Pruritus,not develop severe Pruritus,Papules and crusts develop on pinnae,Progresses to the legs and feet and perineum,Lesions,Skin becomes thickened,gray-yellow crust,Large patches of lesions,Peripheral lymphadenopathy,,,,
Sertoli Cell Tumor,both,fifteen,Blood in the urine,shrinkage,lose weight,appear pale,hair loss in the area of the tumor,hyperpigmentation of the skin,a mass in the abdomen,,,,,,,,
Panniculitis,both,common,multiple subcutaneous nodules,Firm,Nodules few millimeters to several centimeters in diameter,Involved fat may necrose,Exudate usually a small amount of oily discharge,Bloody,Lesions,Anorexia,Pyrexia,Lethargy,depression,,,,
Cerebellar Degeneration ,both,common,Hypermetria,Broad-based stance,Swaying of body,Intention Tremors,Lack of menace responses with normal,vision and pupillary light reflexes,Head tilt and episodes,Diffuse tapetal hyperreflectivity,Decerebellate posture,opisthotonos,,,,,
Eosinophilic Granuloma Complex,male,five,Rapid onset,Nasal and muzzle swelling,Pain,Exudation,Large and Swollen erythematous lesions,Bumps and nodules on the body,,,,,,,,,
Hypoparathyroidism,female,common,Tingling sensation,Twitching facial muscles,Muscle pains,Tiredness,Dry and rough skin,Coarse hair that breaks easily and can fall out,Fingernails that break easily,,,,,,,,
Ovulatory Failure,female,ten,Difficulty getting pregnant,Hot flashes,Night sweats,Vaginal dryness,Dry eyes,Irritability or difficulty concentrating,Decreased sexual desire,,,,,,,,
Lactic Acidosis,both,common,attempted respiratory compensation,Dehydration,dark mucous membranes,increased skin turgor,Severely acidotic,,,,,,,,,,
Adenocarcinoma - Lung,both,ten,Difficulty breathing,Rapid breathing,Extreme tiredness,Weakness,Loss of Appetite,Weight loss,Vomiting,Bloody,Fever,Muscle pain and Weakness,,,,,
ChondrosarComa - Larynx and Trachea ,both,common,Voice change,breathing,Coughing,Exercise intolerance,Severe Respiratory distress,Cyanosis,Collapse,Dysphagia,,,,,,,
Pneumocystosis,both,common,Weight loss,Exercise intolerance,Dyspnea,Coughing,Vomiting,Cachexia,,,,,,,,,
Tick Bite Paralysis,both,common,Heavy breathing,Coughing,Vomiting,Heavy salivation,Wobbly legs,Collapse,,,,,,,,,
Lumbosacral Stenosis and Cauda Equina Syndrome ,both,five,Lumbosacral pain,reluctance to jump,Pain on pressure,induced during extension of hip joints,Lameness,Abnormal tail carriage,Weakness,results from dysfunction of caudal nerves,Self-inflicted lesions,,,,,,
Hyperviscosity Syndrome,both,common,Loss of Appetite,Lethargy,Depression,Excessive urination and excessive thirst,Blindness,unsteadiness,Bleeding tendencies,Seizures,Rapid heartbeat,Nosebleed,optic swelling,,,,
Diabetes Mellitus without Complication,female,common,increased urination,Increased thirst,Weight loss,Hepatomegaly,Lethargy,Depression,Inappetance,Lack of appetite,Vomiting,,,,,,
Lizard Venom Toxicosis ,both,common,Sudden onset of pain,Bite usually on the face,lizard may still be attached,Bleeding from bite site,Hypotension,Extremely painful bite site,Localized swelling,edema slower to develop than rattlesnake bite,Excessive salivation,Excessive lacrimation,Frequent urination and defecation,,,,
Ameloblastoma ,both,common,Bloody,Drooling,Tooth pain,Difficulty eating and drinking,Refusing food,Pawing at the mouth or face,Chewing on one side of the mouth,Loose teeth,Lymph node,,,,,,
Ophthalmia Neonatorum ,both,common,Swollen eyelids,Red eyes,outward bulge,lost vision,Collapse,corneal adhesions,uicerated cornea,perforated cornea,mucoid discharge from eyelids,,,,,,
Squamous Cell Carcinoma-Nasal and Paranasal Sinuses,male,common,Runny nose that goes on for a long time,Bloody,Excessive tear,Sneezing,Bad breath,Loss of Appetite,Seizures,Bulging eyes,Nose seems deformed,,,,,,
Fiber-Responsive Large Bowel Diarrhea,both,common,Hematochezia,Excess fecal mucus,Tenesmus,Abdominal pain,Vomiting,,,,,,,,,,
Pneumothorax,both,common,Traumatic recent Trauma,thoracocentesis,jugular venipuncture,lung aspirate,thoracotomy,mechanical ventilation,neck surgery,Recent anesthesia,Spontaneous,Respiratory distress,Shallow,rapid abdominal breathing common,Decreased to absent breath sounds dorsally,Cyanosis,Tachycardia
Ectropion,both,five,Protrusion of the bottom eyelid,exposing tissue below the eyeball,below the eyes stained a brownish color by tear,Redness and other signs of irritation,Pink eye,Pawing at the eye,Discomfort,,,,,,,,
Microsporidiosis ,both,common,Postpartum,Stunted growth,Ill-thrift,Depression,Weight loss,Nephritis progressing to renal failure,Neurologic abnormalities,Convulsions,viciousness,Biting,Vocalization,ataxia,circling,Hypermetria,White eye
Blepharitis ,both,ten,Serous,mucoid,mucopurulent ocular discharge,Blepharospasm,Eyelid hyperemia,edema,thickening,Pruritus,Excoriation,Depigmentation,Alopecia,Swollen,cream-colored meibomian glands,Elevated,Dry eye
Tetralogy of Fallot,both,common,Weakness,Dyspnea or shortness of breath,Exercise intolerance,Slower rate of growth than littermates,Fainting,Seizures,Cyanosis,,,,,,,,
Canine Infectious Respiratory Disease ,both,ten,respiratory tract damage,Can be subclinical,mild or severe with pneumonia,Most viral,mycoplasmal,the infecting agents,Coughing,dry and hacking,moist and hacking,retching and expectoration of mucus,,,,,
Hiatal Hernia,male,five,Regurgitation,Coughing,Nasal discharge,Hypersalivation,Weight loss,Shortness of breath,Lack of appetite,,,,,,,,
Mycotoxicosis?Tremorgenic Toxins ,both,common,Vomiting,hyperresponsive to external stimuli,Panting,Hyperactivity,Vomiting,ataxia,Incoordination,Weakness,Tachycardia,rigidity,Seizures,may lead to hyperthermia,Hypoglycemia,Dehydration,depression
Ileus,both,five,Struggling to have a bowel,Reluctant to have a bowel movement,Constipation,Thin ribbon like stool,Absence of intestinal noise,Vomiting,Abdominal pain,Abdominal distention,Weight loss,Lack of appetite,Palpable lump,,,,
Paraneoplastic Syndromes,both,common,muscle pain,Alopecia,Anemia,Cachexia,Cutaneous flushing,Diencephalic syndrome,Disseminated,intravascular coagulation,Eosinophilia,Gastroduodenal Ulceration,Hypercalcemia,Hypertrophic osteopathy,Hypoglycemia,Myelofibrosis,Bleeding
Hydronephrosis,both,common,Loss of Appetite,Restlessness,Excessive thirst and urination,Blood in urine,Signs of uremia,Bad breath,Mouth sores,Vomiting,Abdominal pain,Lower Back pain,Abdominal distention,,,,
Cuterebriasis ,both,common,Dermatologic,warble containing bot,Neurologic,ataxia,circling,paralysis,Blindness,recumbency,Lesions,larva in conjunctiva,Respiratory,,,,
Roundworms,both,common,Potbelly,Weakness,Diarrhea,Vomiting,Belly pain,Dull coat,Weight loss,Malnourishment,,,,,,,
Brachycephalic Airway Syndrome ,both,five,Snoring,stridor,stertorous breathing,Tachypnea,Panting,Coughing,Difficulty eating and swallowing,Ptyalism,Regurgitation,Vomiting,Syncope and episodes of collapse,,,,
Metritis ,both,common,MalOdorous,purulent,sanguinopurulent,dark green Vulvar discharge,Depression,Anorexia,Neglect of puppies and kittens,Reduced milk production,Polyuria,Fever,Large uterus on abdominal palpation,Dehydration,Injected mucous membranes,Tachycardia,
Cold Agglutinin Disease ,both,common,Often a history of cold exposure,Cyanosis,Erythema,Skin Ulceration with secondary crusting,Dry,gangrenous necrosis of ear tipsor and tail tip and nose and feet,Affected areas may be painful,Anemia may or may not be an important feature,pallor,Weakness,Tachycardia,tachypnea,Icterus,pigmenturia,Abdominal pain
Cryptorchidism ,both,common,Bilaterally cryptorchid animals are infertile,Unilaterally cryptorchid,Rarely associated with pain or other signs of disease,Abdominal pain,spermatic cord,Feminizing paraneoplastic syndrome,gyneComastia,Alopecia,hyperpigmentation of inguinal skin,pendulous preputial sheath,prostatic squamous metaplasia,,,,
Strongyloidiasis,both,common,Diarrhea,Diarrhea,Weight loss,Reduced growth in puppies,Pneumonia in puppies,Weakness,Lack of appetite,Intestinal inflammation,Fever,Shallow rapid breathing,,,,,
Intervertebral Disc Disease-Cervical,both,common,Stiff neck with reluctance,Neck Pain,Altered gait,muscle spasms,Partially paralyzed in all four limbs,,,,,,,,,,
Hypermagnesemia,both,common,Nausea,Vomiting,Weakness,Lowered heart rate,Paralysis,Depression,Poor reflexes,Depression,Cardiac arrest,Coma,,,,,
Primary Ciliary Dyskinesia,both,common,Sneezing,Nasal discharge,Coughing,Exercise intolerance,Dramatic initial response,Bilateral mucopurulent Nasal discharge,Productive Coughing,Tachypnea,dyspnea,Diffuse increase in lung sounds,Heart sounds can be inaudible,,,,
Dermatoses-Neoplastic,both,ten,Abdominal swelling,Bleeding from the mouth or nose,Difficulty breathing,Difficulty eating,Lumps,discolored skin,Non-healing wounds,Vomiting,Sudden changes in weight,Unexplained swelling,Lameness,Visible mass,,,
Actinomycosis,male,five,Infections usually localized,may be disseminated,cervicofacial area commonly involved.,Cutaneous swellings or abscesses with draining tracts,Pain,fever,Weight loss,Exudative pleural or peritoneal effusions,Coughing,dyspnea,decreased ventral lung sounds,Retroperitonitis lumbar pain,rear limb paresis,redness,
Colitis - Histiocytic Ulcerative ,both,common,Bloody,mucoid diarrhea,Tenesmus,Weight loss,,,,,,,,,,,
Deafness,both,common,Difficulty localizing sound,change in attentiveness,Appear unresponsive to everyday sounds,Appear unresponsive to his or her name,Be difficult to rouse from sleep,Often they are easily startled,Bark excessively,Fail to respond to familiar verbal commands,Be difficult to rouse from sleep,Be less active,,,,,
Epiphora,both,common,Dampness or wetness beneath the eyes,Reddish-brown staining,Odor,Skin irritation,Skin infection,,,,,,,,,,
Adenocarcinoma - Prostate,male,ten,Tenesmus,Weight loss,Stranguria and Dysuria,Lameness,Weakness,Lethargy,Exercise intolerance,,,,,,,,
Lizard Venom Toxicosis ,both,common,Sudden onset of pain,Bite usually on the face,lizard may still be attached,Bleeding from bite site,Hypotension,Extremely painful bite site,Localized swelling,edema slower to develop than rattlesnake bite,Excessive salivation,Excessive lacrimation,Frequent urination and defecation,,,,
Atlantoaxial Instability,both,common,progressive ambulatory tetraparesis,Neck Pain,Neurologic signs,tetraplegia depending,Weakness,increased muscle tone,,,,,,,,,
Heat Stroke and Hyperthermia,both,common,Drooling,Thick saliva,Bright red tongue and gums,Decreased urine output,Rapid heart rate,Irregular heart rate,Cardiopulmonary arrest,Breathing distress,Lethargy,Weakness,Change in mood,Muscle Tremors,Stiffness,Unstable gait,Dizziness
Splenic Torsion,both,common,Collapse,Abdominal pain,Vomiting,Lack of appetite,Swelling of the abdomen,Weight los,Increased drinking and urination,Urine color changes may look like port wine,Lethargy,Depression,,,,,
Paraproteinemia,both,fifteen,Weakness,Lameness,paresis,Epistaxis or gingival Bleeding,Petechiae or ecchymoses,Blindness or retinal Hemorrhage,Polyuria and Polydipsia,Seizures,,,,,,,
Small Intestinal Dysbiosis,both,five,Gas,Bloating,Diarrhea,Abdominal pain,Bad breath,Hyperactivity,Bladder infections,Weight loss,Gum disease,Immune system disorders,Respiratory illnesses such as asthma,Allergies,Joint pain,Gastrointestinal cancer,
Contact Dermatitis ,both,common,Lesions,Location determined by antigen contact,commonly limited to glabrous skin,Thick hair coat,Extreme erythroderma stops abruptly at the hairline,Erythema,vesicles uncommon,hyperpigmentation,,,,,,,
Renomegaly,both,common,Lethargy,Vomiting,Diarrhea,Oral ulcers,Dehydration,Weight loss,Loss of Appetite,Discolored urine,Pale mucous membrane,Foul-smelling breath,Abdominal pain,Abdominal mass,Abnormally large abdomen,One or both kidneys palpably large,Excess urine
Encephalitis,both,five,Fever,Seizures,Tremors,Blindness,Loss of coordination,Pain,Paralysis,Behaviour changes,Circling,Head tilt,,,,,
Urolithiasis -  Struvite ,female,common,Some dogs are Asymptomatic,number of uroliths,Pollakiuria,Dysuria and Hematuria,sometimes small or smooth uroliths are voided,Pollakiuria,sometimes small or smooth uroliths are voided,Nephroliths,Obstruction to urine outflow,Uroliths,Obstruction of the urethra,Obstruction,ascending urinary tract infection,Not eating,
Premature Labor,female,common,Early no signs,fetal resorption evident,Later Vulvar discharge,hemorrhagic or lochial,History of unexplained loss of pregnancy,,,,,,,,,,
Retinal Degeneration,male,five,Night Blindness,Blindness in light,Dilated pupils,Inability to see clearly in bright light,only central vision may be lost,abnormal reactions to light,The liver may also be affected,Sudden Blindness,,,,,,,
Degenerative Myelopathy,both,ten,Swaying in the hind end when standing,Easily falls over if pushed,Wobbling,Knuckling of the paws when trying to walk,Feet scraping on the ground when walking,Abnormally worn toenails,Difficulty walking,Difficulty getting up from a sitting,Falling down when walking or standing,Inability to walk,Paralysis of the hind limbs,Difficulty with swallowing and tongue movements,Urinary and fecal incontinence,limbs,
Perianal Fistula,both,ten,Dyschezia,Tenesmus,Hematochezia,Constipation,Diarrhea,MalOdorous,Ulceration of the perianal skin with sinus tract formation,Licking and self-mutilation,Reluctance to sit,posturing difficulties,personality changes,Pain on manipulation perianal area,Fecal incontinence,Anorexia,Weight loss
Nonsteroidal Anti-Inflammatory Drug Toxicosis ,both,common,Fever,Lethargy,Anorexia,Vomiting,Diarrhea,Icterus,Melena,secondary to a perforated gastric ulcer,Polyuria,Polydipsia and Oliguria,Ataxia,Seizures,Depression,Pale mucous membranes,Painful abdomen
Gastritis-Atrophic,male,common,Stomach pain,Dehydration,Diarrhea,An increase in thirst,Appearing lethargic,Disinterest in food,Vomiting,Weakness,Losing weight,Lack of appetite,,,,,
Hepatic Amyloid,both,common,Fever,Swollen hocks,Joint inflammation,Joint pain,Lack of energy,Loss of Appetite,Abdominal discomfort,Swelling,Buildup of abdominal fluid,Vomiting,Excessive thirst,Excessive urination,,,
Polypoid Cystitis,both,common,Hematuria is the most common sign,Gross Hematuria,Dysuria,Urethral obstruction,Polyps originating,surround the ureteral orifice,Urinary tract infection,,,,,,,,
Pericarditis,both,fifteen,tamponade,Collapse,Weakness,Anorexia,high central venous pressure,noticeable weakening,muffled or distant heart sounds,Ascites prominent among them,chronically elevated central venous pressures,,,,,,
Coonhound Paralysis ,both,common,Appear 7?14 days after contact with raccoon saliva,bite or scratch,receipt of a vaccination,gastrointestinal infection,Initial signs,stiff,stilted gait in all limbs,typically starting in the pelvic limbs,Rapid progression (2?4 days) to a flaccid,ower motor neuron tetraparesis to tetraplegia,loss or change of voice,water consumption,Urination,Blindness,
Campylobacteriosis ,both,ten,Diarrhea,bile streaked,Tenesmus,Fever,Anorexia,Vomiting,,,,,,,,,
Squamous Cell Carcinoma-Tongue,female,fifteen,Drooling,Bleeding from the mouth,Facial swelling,Difficulty chewing,Bad breath,Halitosis,Loose teeth,Small white growth on the tongue,resembling warts,,,,,,
Vaginal Tumors ,both,fifteen,Extraluminal slow-growing perineal mass,Vulvar discharge,Dysuria,Pollakiuria,vulvar licking,dystocia,Intraluminal mass protruding from the vulva,Stranguria,tenesmus,,,,,,
Congenital and Developmental Renal Diseases ,both,common,Chronic,Abdominal distension,edema,nephrotic syndrome,Abdominal distension,Abdominal pain,Unilateral,frequently Asymptomatic,,,,,,,
Hip Dysplasia,both,five,Stiffness,Exercise intolerance,Difficulty rising,Difficulty climbing stairs,Abnormal gait,Limping on one or both hind limbs,Pain,,,,,,,,
Bronchiectasis ,both,ten,Chronic,hemoptysis,Fever,Exercise intolerance,Tachypnea,Chronic,particularly with primary ciliary dyskinesia,Moist,harsh inspiratory crackles,loud expiratory lung sounds,Tracheal hypersensitivity,,,,
Bile Peritonitis ,both,common,Lethargy,Abdominal pain,Jaundice,Abdominal effusion,Fever,Endotoxic shock,Abdominal discomfort,Anorexia,Diarrhea,Weight loss,Abdominal distention,Collapse,,,
Shock-Hypovolemic,both,common,Weakness,Cool feet,Poor pulse,Very low blood pressure,Lethargy,Hyperventilation,Respiratory failure,Hemorrhage,,,,,,,
Panniculitis,both,common,multiple subcutaneous nodules,Firm,Nodules few millimeters to several centimeters in diameter,Involved fat may necrose,Exudate usually a small amount of oily discharge,Bloody,Lesions,Anorexia,Pyrexia,Lethargy,depression,,,,
Ventricular Septal Defect ,both,common,Usually Asymptomatic,dyspnea,Exercise intolerance,Syncope and Coughing,right hemithorax,pulmonic stenosis heard over the left heart base,A diastolic decrescendo murmur results if the VSD undermines anatomic support of the aortic valve,Regurgitation,right-to-left shunts,Split-second heart sound,Femoral pulses usually normal,,,,
Nonsteroidal Anti-Inflammatory Drug Toxicosis ,both,common,Fever,Lethargy,Anorexia,Vomiting,Diarrhea,Icterus,Melena,secondary to a perforated gastric ulcer,Polyuria,Polydipsia and Oliguria,Ataxia,Seizures,Depression,Pale mucous membranes,Painful abdomen
Diabetes Insipidus,both,five,Excessive urination,Excessive drinking,Weight loss,Failure to thrive,Incontinence?occasional,,,,,,,,,,
Pleural Effusion,both,common,Dyspnea,Tachypnea,Orthopnea,Open-mouth breathing,Cyanosis,Exercise intolerance,Lethargy,Inappetence,Coughing,respirations often shallow and rapid,lung sounds ventrally,Preservation of breath sounds dorsally,Dullness ventrally on thoracic percussion,,
Cobalamin Deficiency ,both,common,Chronic,diarrhean,Weight loss,Vomiting,poor appetite,Failure to thrive,loose stools,steatorrhea,polyphagia,even pica,borborygmus,Flatulence,poor hair coat,Lethargy,Anorexia
Diarrhea-Chronic,both,five,Weight loss,Vomiting,Abnormally large volume of feces,Frequency of defecation increases,Gaseous sounds from the gut,Black and tarry stool,Very hearty appetite,Abnormally smaller volume of feces,Frequency of defecation increases,Bright and red blood,Straining to defecate and urgency to defecate,Pain while defecating,Gaseous sounds from the gut,,
Anaphylaxis,female,five,Vomiting,Diarrhea,Pale gums,Cold limbs,Drooling,Difficulty breathing,Increased heart rate or a weak pulse,,Shock,Coma,,,,,
Mastitis ,both,common,Anorexia,LethargyNeglect of puppies or kittens,Failure of puppies or kittens to thrive,Firm,Swollen,Warm and painful,Fever,Dehydration and septic shock,Abscessation or gangrene of glands,,,,,,
Canine Coronavirus Infections ,both,common,Vary greatly,Rarely virulent isolates,most infections inapparent,occasionally fatal enteritis,Vomiting,,,,,,,,,,
Colitis and Proctitis ,both,common,Fecal consistency,small fecal volume,Tenesmus,Increased fecal mucus,Occasional dyschezia,Vomiting,Weight loss,colonic lymphoma,histoplasmosis,pythiosis,,,,,
Arthritis - Osteoarthritis ,both,common,Stiffness,Lameness,difficulty getting up,Lethargy,Reluctance to run or jump or play,Weight gain,Irritability or changes in behavior,,Difficulty posturing to urinate,Loss of muscle mass,,,,,
Atrial Septal Defect ,both,common,Cyanosis,Exercise intolerance,Syncope,Coughing,dyspnea,Soft systolic murmur over the pulmonic valve,Rarely a diastolic murmur,,,,,,,,
Pyoderma,both,common,Superficial usually involves the trunk,obscured by hair coat,affects the chin or bridge of the nose,Systemic illness,staphylococcal infection itself,may not be pruritic if associated with hypercortisolemia,Papules,Pustules,Crusted Papules,Crusts,Epidermal collarettes,Circular erythematous or hyperpigmented patches,Alopecia,moth-eaten hair coat,Hemorrhagic bullae
Ectropion,both,five,Protrusion of the bottom eyelid,exposing tissue below the eyeball,below the eyes stained a brownish color by tear,Redness and other signs of irritation,Pink eye,Pawing at the eye,Discomfort,,,,,,,,
Lymphadenitis ,both,common,Lymph node,organ dysfunction,Lymph node,Bacterial,Fever,,,,,,,,,,
Hemoglobinuria and Myoglobinuria,male,common,Blood in urine,Bruises and pain,Lack of energy,Loss of Appetite,Weight loss,Yellowing of the skin and eyes,Lethargy,,,,,,,,
Neuroaxonal Dystrophy ,both,five,Cerebellar ataxia,progressive dysmetria,Strength and proprioception normal in most cases,exhibit proprioceptive deficits,Loss of menace responses,brainstem involvement,including loss of swallowing reflex,tetraplegia may develop in the final stages,Mild intention tremor,,,,,,
Renomegaly,both,common,Lethargy,Vomiting,Diarrhea,Oral ulcers,Dehydration,Weight loss,Loss of Appetite,Discolored urine,Pale mucous membrane,Foul-smelling breath,Abdominal pain,Abdominal mass,Abnormally large abdomen,One or both kidneys palpably large,Excess urine
Lead Toxicosis ,both,five,Vomiting,Diarrhea,Anorexia,Abdominal pain,Lethargy,Hysteria,Seizures,Blindness,,,,,,,
Aspergillosis - Nasal ,both,ten,Unilateral,Increased nasal airflow,Depigmentation,planum,Facial pain,Ipsilateral mandibular lymphadenopathy,Sneezing,,,,,,,,
Seminoma,both,fifteen,Blood in the peritoneal cavity,Blood in the urine,Enlarged scrotum,Infertility,Spermatic cord torsion,Swelling of either or both testicles,Unexplained growth,Hair loss or poor regrowth,Brittle hair,Thinning of the skin,Darkening of the skin,Penile atrophy,Testicular atrophy,Changes in prostate size,Mammary enlargement
Anemia - Non Regenerative,female,common,Tachycardia,Pale mucous membranes,Abnormal peripheral pulses,Hypotension,Lethargy,Weakness,Anorexia,Splenomegaly,Abdominal distension,Heart murmur,Jaundice,Fever,Shock,,
Pleural Effusion,both,common,Dyspnea,Tachypnea,Orthopnea,Open-mouth breathing,Cyanosis,Exercise intolerance,Lethargy,Inappetence,Coughing,respirations often shallow and rapid,lung sounds ventrally,Preservation of breath sounds dorsally,Dullness ventrally on thoracic percussion,,
Paraproteinemia,both,fifteen,Weakness,Lameness,paresis,Epistaxis or gingival Bleeding,Petechiae or ecchymoses,Blindness or retinal Hemorrhage,Polyuria and Polydipsia,Seizures,,,,,,,
Vaginal Discharge ,both,common,Discharge from the vulva,Licking,Scooting,Postpartum,Recent estrus with pyometra,Hemorrhagic discharge,Vomiting,Vaginal discharge that may be serosanguinous,purulent,lochial,hemorrhagic,mucoid or urinous,,,
Cyclic Hematopoiesis ,both,common,Weakness,Failure to thrive,Conjunctivitis,Gingivitis,Diarrhea,Pneumonia,Skin infections,Carpal Joint pain,,,,,,,
Pneumonia-Eosinophilic,both,ten,Coughing unresponsive to antibacterial therapy,Labored breathing,Exercise intolerance,Anorexia,Lethargy,Weight loss,Nasal discharge,Fever,Harsh,moist Coughing,Tachypnea,Abnormal breath sounds,crackles,wheezes,difficult to breath
Corneal Opacities - Degenerations and Infiltrates ,both,common,associated ocular or systemic disorders,Lipid,gray white or crystalline,can be band-shaped or irregular or circular,Calcium dense white to crystalline regular,superficial stroma,keratitis or Uveitis,Corneal vascularization,edema and pigmentation often present,With progression the cornea,,,,,
Digoxin Toxicity,both,common,Depression,Lack of appetite,Vomiting,Diarrhea,Lethargy,,,,,,,,,,
Staphylococcal Infections,both,common,peeling of skin,Red and inflamed skin,Pain,Excessive itching or chewing or licking,Lesions,Infections of the eyes,,,,,,,,,
Gastritis-Chronic,both,common,Abdominal pain,indigestion,Bloating,Nausea,Vomiting,Belching,Loss of Appetite,Weight loss,Diarrhea,,,,,,
Necrotizing Encephalitis ,both,common,Progressive signs related to a forebrain lesion,Abnormal behavior,Seizures,circling,Blindness,Lesions,multifocal lesion,,,,,,,,
Streptococcal Infections,both,common,Pain,Fever,Arthritis,Lethargy,Coughing,Pneumonia,Abscess,Difficulty swallowing due to swelling,,,,,,,
Rectoanal Polyps,both,ten,The presence of bright red blood in the feces,Straining when defecating,Itchy anus,Scouting on the floor,Feces may have mucus,Dog whimpers,Dyschezia,,,,,,,,
