Legg-Calve-Perthes,both,five,Lameness,weight-bearing occasionally leg is carried,Pain on manipulation of the hip,Crepitation of the joint,Atrophy of the thigh muscles,,,,,,,,,,
Myocardial Tumors,both,ten,Collapse,Abdominal distention,Exercise intolerance,Dyspnea,Anorexia,Vomiting,Diarrhea,Acute death,,,,,,,
Dermatoses-Sterile Nodular,both,five,Occasionally painful,Fever,Inappetence,Lethargy,Multiple lesions,,,,,,,,,,
Pyelonephritis,both,common,Maybe Asymptomatic,Polyuria or Polydipsia,Abdominal or lumbar pain,Signs associated with lower urinary tract,infection,Dysuria,Pollakiuria,periuria Stranguria,MalOdorous,Pain upon palpation of kidneys,Fever,,,,
Myoclonus ,both,common,bout of gastrointestinal,Coughing,persists at rest and even during sleep or light anesthesia,consistent frequency in a given patient,distemper diagnosis,Chronic,Familial reflex myoclonus observed,limbs and neck and head,patient unable to rise without assistance,With spongy degeneration,,,,,
Tetanus,both,common,Curled lips,Clenched jaw,Trouble swallowing,Drooling,Stiffness,Difficulty walking,Muscle Tremors or spasms,Unable to bend legs,Difficulty breathing,,,,,,
Coonhound Paralysis ,both,common,Appear 7?14 days after contact with raccoon saliva,bite or scratch,receipt of a vaccination,gastrointestinal infection,Initial signs,stiff,stilted gait in all limbs,typically starting in the pelvic limbs,Rapid progression (2?4 days) to a flaccid,ower motor neuron tetraparesis to tetraplegia,loss or change of voice,water consumption,Urination,Blindness,
Pulmonary Thromboembolism,both,common,Often reflect the primary disease process,fever,peracute dyspnea,Anorexia,Syncope,Collapse,Coughing,,,,,,,,
Right Bundle Branch Block,both,common,Exercise intolerance,Weakness,Lethargy,Fainting,Increased breathing rate,Fluid in the abdomen,,,,,,,,,
Baylisascariasis ,both,common,Intestinal form-none,Weakness,ataxia,dysphagia,circling,recumbency,,,,,,,,,
Keratitis - Nonulcerative ,female,common,Chronic,usually bilateral,cornea vascularization ranging from superficial,lateral or ventrolateral cornea,thickened and depigmented third eyelids,leading edge of corneal lesion,may lead to Blindness,Pigmentary keratitis,appears as focal to diffuse,brown discoloration of the cornea,corneal vascularization or scarring,Pigmentary keratopathy,brown corneal pigmentation,,
Hypopituitarism,both,five,Hair loss on sides,No permanent teeth,Small penis and testicles,Irregular or no heat cycles,Lethargy,Mental deterioration,Weight loss,Death,Thin and hypotonic skin,,,,,,
Ventricular Tachycardia ,both,common,Syncope,Weakness,Exercise intolerance,Sudden death,May be Asymptomatic,arrhythmia is paroxysmal,Tachycardia,Femoral pulses,arrhythmia,,,,,,
Hemothorax,both,common,Weakness,Collapse,Labored breathing,Rapid breathing,Lethargy,Low tolerance to exercise,Bluish skin and gums,,,,,,,,
Ectopic Ureter,female,five,urine leaking,Discolored fur around the vulva,Licking of the genital area,Irritation from urine,Recurrent urinary tract infections,,,,,,,,,,
Taurine Deficiency,both,common,Panting,Collapsing or fainting,Blood in the urine,Pain during urination,Abdominal pain,Moderate to severe Blindness,,,,,,,,,
Protothecosis,female,common,diarrhea,Weight loss,Acute onset Blindness,Neurologic disease,deafnes,Seizures,ataxia,Lesions,Gastrointestinal,ocular or neurologic,Weight loss,Hemorrhagic colitis,Vomiting,Anorexia,Blindness
Ileus,both,five,Struggling to have a bowel,Reluctant to have a bowel movement,Constipation,Thin ribbon like stool,Absence of intestinal noise,Vomiting,Abdominal pain,Abdominal distention,Weight loss,Lack of appetite,Palpable lump,,,,
Zinc Toxicosis ,both,common,Anorexia,Vomiting,Diarrhea,Lethargy,Pale or icteric mucous membranes,Hemoglobinemia,Hemoglobinuria,Orange-tinged feces,Tachycardia,,,,,,
Azotemia and Uremia,both,common,Weight loss,Anorexia,Reduced activity,Depression,Fatigue,Weakness,Vomiting,Diarrhea,Halitosis,Constipation,Polyuria,Changes in urine volume,Poor haircoat,,
Pneumonia-Interstitial,both,common,Tachypnea,Coughing,respiratory difficulty,Exercise intolerance,Open mouth breathing,end inspiratory and early expiratory crackles,orthopnea,Cyanosis,hemoptysis,Vomiting,Oliguria,Diarrhea,Retinitis,Uveitis,difficult to breath
Vaginal Tumors ,both,fifteen,Extraluminal slow-growing perineal mass,Vulvar discharge,Dysuria,Pollakiuria,vulvar licking,dystocia,Intraluminal mass protruding from the vulva,Stranguria,tenesmus,,,,,,
Melanocytic Tumors - Oral ,both,common,Excessive salivation,Halitosis,Dysphagia,Bloody,Weight loss,Oral mass often friable,Loose teeth,Facial deformity,Regional lymphadenomegaly,Pain or discomfort,,,,,
Immunodeficiency Disorders-Primary,male,five,Diarrhea,Lethargy,Weakness,Loss of Appetite,Lesions,Pain within the joints,Lameness,Anemia,Recurrent illnesses,Vomiting,Seizures,,,,
Apudoma,both,ten,Weight loss,Vomiting,Vomiting,Diarrhea,Depression,Lethargy,Pain in the abdomen,Dried blood in the stool (Melena),Fresh blood in the stool,Acid reflux,Ulcers,Gastritis,,,
Hypoadrenocorticism ,female,common,Depression,Lethargy,Lack of appetite,Weight loss,Vomiting,Diarrhea,Bloody,Hair loss,Increased urination,Increased thirst,Dehydration,Shaking,Weak pulse,Irregular heart rate,Low temperature
Ehrlichiosis,both,five,Fever,Lethargy,Loss of Appetite,Weight loss,Abnormal Bleeding,Lymph node,Enlarged spleen,Stiffness,Coughing,Discharge from the eyes and nose,Vomiting,Inflammation of the eye,Incoordination,Depression,paralysis
Lysosomal Storage Diseases ,both,common,,Vary with severity of the enzyme deficiency,predominate,Affected animals are normal at birth,mucopolysaccharidoses,Neurologic,,,,,,,,,
Vaginal Hyperplasia and Prolapse ,both,five,Onset of proestrus or estrus,parturition,Licking of vulvar area,Failure to allow copulation,Dysuria,Previous occurrence,Protrusion of round,tongue-shaped or donut-shaped tissue mass,Vaginal examination ocate lumen and urethral orifice,Tissue may be dry or necrotic.,,,,,
Uterine Inertia ,both,common,failure of gestation,Asymptomatic except,fetal heart rates decline with delay in intervention,contractions cease despite,may deliver part of litter and then stop,fetal heart rates decline with delay in intervention,,,,,,,,,
Pyruvate Kinase Deficiency,both,common,Lethargy,Pale mucous membranes,Often Splenomegaly,Tachycardia,Systolic heart murmurs reported in dogs,Icterus is occasionally seen in cats but rarely seen in dogs,Weakness,Diarrhea,inappetence,poor coat quality and weight loss,,,,,
Gallbladder Mucocele,both,common,Loss of Appetite,Lethargy,Vomiting,Diarrhea,Lack of appetite,Jaundice,Abdominal discomfort or pain,Fever,Abdominal distension,Dehydration,Excessive urination,Excessive thirst,Collapse,,
Hyperadrenocorticism,female,common,Increased thirst,Increased urination,Increased appetite,Reduced activity,Excessive Panting,Thin or fragile skin,Hair loss,Recurrent skin infections,Enlargement of the abdomen,,,,,,
Patellar Luxation,both,common,limbing,Occasional skipping,Lameness,patella,patella can be manually displaced,extends the stifle joint,Patient intermittently carries,patella remains luxated most of the time,reluxation of the patella,patella is permanently luxated,shallow or missing femoral trochlea,crouching,bowlegged,Lameness,Pain
Diarrhea- Antibiotic Responsive,both,five,Diarrhea,Diarrhea,Loss of Appetite,Weight loss,Straining when having bowel movement,Intestinal sounds,Gas,,,,,,,,
Shock-Cardiogenic,both,common,Rapid breathing,Severe shortness of breath,Sudden and rapid heartbeat,Loss of consciousness,Weak pulse,Low blood pressure,Sweating,Pale skin,Cold hands or feet,Urinating less,,,,,
Atrial Standstill,female,five,Abdominal distention,Coughing,Cyanosis,Difficulty breathing,Muscle wasting,Lethargy,,,,,,,,,
Chagas Disease,male,common,Lethargy,Depression,Anorexia,Diarrhea,Weakness,Exercise intolerance,Mild to severe CNS dysfunction,Ataxia,Seizures,,,,,,
Shock-Septic,both,common,Shaking,Fever,Weakness,Confusion,Rapid heart rate,Bounding pulses,Rapid rise in temperature,Panting,Decrease in urinary output,Glucose deficiency in bloodstream,Red mucous membranes,Pale mucous membranes,Inconsistencies in pulse,Cool extremities,A daze-like condition
Dermatophilosis,both,common,Lesions,Weeping sores,Scabby abrasions,Groups of hairs under the bumps,Rash is usually on the head or neck,,,,,,,,,,
Anal Sac Disorders,both,common,Scooting,Licking or Biting their rear end,A bad smell,Constipation or pain when pooping,Perianal Pruritus,Hesitancy to defecate,Tenesmus,Tail chasing,Foul-smelling,non-feces anal discharge,Refusal to sit or lift tail,,,,
Premature Labor,female,common,Early no signs,fetal resorption evident,Later Vulvar discharge,hemorrhagic or lochial,History of unexplained loss of pregnancy,,,,,,,,,,
Hypoparathyroidism,female,common,Tingling sensation,Twitching facial muscles,Muscle pains,Tiredness,Dry and rough skin,Coarse hair that breaks easily and can fall out,Fingernails that break easily,,,,,,,,
Polycystic Kidney Disease,both,common,Abdominal enlargement,cyst formation,May detect bosselated kidneys by abdominal palpation,renal capsule and pain,,,,,,,,,,,
Amitraz Toxicosis,male,common,Depression,Weakness,Ataxia,Bradycardia,Vomiting,Hyperthermia,Hyperglycemia,Polyuria,Mydriasis,Gastrointestinal stasis,,,,,
Dermatoses-Depigmenting Disorders,both,common,Leukotrichia or the whitening of the hair,skin pigment disappearing,Lightening of the skin color,Erythema,Ulceration of the skin or loss of some of the skin,,,,,,,,,,
Atherosclerosis ,male,five,Lethargy,Anorexia,Weakness,Dyspnea,Collapse,Vomiting,Diarrhea,,,,,,,,
Pneumonia-Aspiration,both,common,Peracute,Chronic,Coughing,tachypnea,Exercise intolerance,Cyanosis,Regurgitation,Vomiting,dysphagia,altered consciousness,stertor or stridor,,,,
Panniculitis,both,common,multiple subcutaneous nodules,Firm,Nodules few millimeters to several centimeters in diameter,Involved fat may necrose,Exudate usually a small amount of oily discharge,Bloody,Lesions,Anorexia,Pyrexia,Lethargy,depression,,,,
Hepatotoxins,both,common,Vomiting,Diarrhea,Weakness,Coma in severe cases,Lesions-red or purple spots on the skin,Hemorrhage,yellowing of the skin or whites of the eyes,Dehydration,Increased urination and thirst,Stomach Bloating,Seizures,Sudden fainting,,,
Esophageal Diverticula,both,common,Retching,Gagging,Hypersalivation,Vomiting,Difficulty breathing,Unable to finish eating,Weight loss,Coughing,,,,,,,
Idioventricular Rhythm,both,common,Some animals Asymptomatic,Weakness,Lethargy,Exercise intolerance,Syncope,Heart failure,,,,,,,,,
Thrombocytopenia,both,common,Excessive bruising,Severe or prolonged blood loss,Fever,Lethargy,Heart murmur,Urinary Bleeding,Coughing,Excessive nasal mucus,Sudden collapse,,,,,,
Von Willebrand Disease ,both,five,Hemorrhage from mucosal surfaces,epistaxis,gastrointestinal Hemorrhage,Hematuria,vaginal Hemorrhage,gingival Hemorrhage,Prolonged Bleeding after surgery or Trauma,Blood loss anemia if prolonged Hemorrhage,,,,,,,
Squamous Cell Carcinoma-Ear,both,common,crusty sores on the ears,Redness may come and go,Bleeding from sores on the ears,Sores on the ear that slowly get bigger,ear tips may disappear,ear may become malformed,sores on the face,,,,,,,,
Ameloblastoma ,both,common,Bloody,Drooling,Tooth pain,Difficulty eating and drinking,Refusing food,Pawing at the mouth or face,Chewing on one side of the mouth,Loose teeth,Lymph node,,,,,,
Lipoma - Infiltrative ,female,ten,Large and diffuse and soft tissue mass,muscle swelling,Infiltration of pelvic and lateral cervical musculature,Coughing,,,,,,,,,,,
Incontinence-Fecal,both,common,Diarrhea,Defecating while walking or sleeping,Dragging hind end on the rug or floor,Bloating,Gas,Loss of muscle tone in the anal area,Aggravation,Inability to wag tail,,,,,,,
Polycythemia,female,ten,Transient excitement or vigorous exercise,Lethargy,Anorexia,epistaxis,Seizures,hyperemia of mucous membranes,Vomiting,Diarrhea,low exercise tolerance,behavioral change,brick red or cyanotic mucous membranes,Sneezing,Bilateral epistaxis,Vision loss,Vomiting
Babesiosis ,both,common,Lethargy,Anorexia,pale mucous,membranes,fever,Splenomegaly,lymphadenomegaly,pigmenturia,Icterus,Weight loss,discolored stool,,,,
Colitis - Histiocytic Ulcerative ,both,common,Bloody,mucoid diarrhea,Tenesmus,Weight loss,,,,,,,,,,,
Proteinuria,both,common,severity of proteinuria,glomerular proteinuria,Weight loss,acute dyspnea,pollakiuria,Abdominal distention,May have oral Ulceration,edema or cavitary effusion or changes in pulse quality,,,,,,,
Astrocytoma,both,five,kinetic dependent,Seizures,Behavioural changes,societal interactions,Disorientation,Loss of conscious proprioception,Cranial nerve abnormalities,,,,,,,,
Benzodiazepine and Other Sleep Aids Toxicosis ,both,common,Therapeutic use of drug,Lethargy,Ataxia,Sedation,Agitation,Depression,Ataxia,Sedation,Hypothermia,Agitation,Hyperthermia,Tachycardia,,,
Blepharitis ,both,ten,Serous,mucoid,mucopurulent ocular discharge,Blepharospasm,Eyelid hyperemia,edema,thickening,Pruritus,Excoriation,Depigmentation,Alopecia,Swollen,cream-colored meibomian glands,Elevated,Dry eye
Squamous Cell Carcinoma-Gingiva,both,common,Bleeding from the mouth,Blood in saliva,Difficulty chewing and eating,Difficulty swallowing,Lymph node,Drooling,Facial swelling,Growth or growths in mouth,Loose teeth,Nagging Coughing,Persistent Halitosis,Unexplained weight loss,,,
Proptosis,both,common,Subconjunctival or intraocular Hemorrhage,dilated pupil,Intraocular inflammation,Globe deviation or strabismus or rupture,Corneal Ulceration or desiccatio,Periocular bite wounds,Fractures of the bony orbit or skull,Systemic injuries,Trauma to the contralateral eye,,,,,,
Fears and Anxiety,both,five,Pacing,Posturing with flattened ears,Cowering and hiding,Hair raised on the back of the neck,Drooling,Trembling,Panting,Whining or whimpering,Yawning,Dilated pupils,Excessive grooming,Chronic,Chewing on objects,Incontinence of bowels or urine,Growling
Diabetic Hepatopathy,male,ten,Weight loss,Thirst,Lethargy,yellowish tone most visible in the eyes,Depression,Hypersalivation,Vomiting,Diarrhea,Lesions,,,,,,
Pheochromocytoma,both,common,Weakness,Anorexia,Vomiting,Weight loss,Panting,dyspnea,Diarrhea,Whining,Pacing,Ascites,edema,Shakes or shivers,Epistaxis,Adypsia,Lethargy
Canine Coronavirus Infections ,both,common,Vary greatly,Rarely virulent isolates,most infections inapparent,occasionally fatal enteritis,Vomiting,,,,,,,,,,
Iris Atrophy,both,common,Anisocoria,Dull appearance in the color of the eye,Change in shape of the pupil,Mild sensitivity to bright light,Holes in the iris,Fixed and dilated pupil,Iris thinning,,,,,,,,
Carnitine Deficiency ,both,common,carnitine deficiency can be diverse,produce energy from fatty acids,muscle pain,Weakness,Exercise intolerance,Lethargy,,,,,,,,,
Bile Duct Obstruction,both,ten,Weight loss,Severe Jaundice,Hepatomegaly unless biliary cirrhosis,Cranial mass effect structures,Vague cranial abdominal discomfort,Acholic feces unless enteric Bleeding,Bleeding tendencies,severe bilirubinuria,,,,,,,
Beta-2 Agonist Inhaler Toxicosis ,both,common,Tachycardia,tachyarrhythmias,Lethargy,Weakness,Depression,Hyperactivity,apprehension,Nervousness,Restlessness,Tachypnea,Vomiting,Tremors,,,
Temporomandibular Joint Disorders,both,common,Unable to open or close mouth,Clicking noise,Swelling,Drooling,Deformed mouth or face,Whining when eating,Inability to eat,Visible pain when opening mouth,Appetite loss,Extreme loss of weight,,,,,
FibrosarComa-Nasal and Paranasal Sinus,both,common,Mucus discharge,Abnormal tear development,Pain in or around the nasal cavity,Sneezing,Pawing at the muzzle,Lack of appetite,Bad breath,Seizures,Loose teeth,Facial deformity,,,,,
Hyperosmolarity,both,common,Lethargy,Vomiting,Weakness,Lack of appetite,Increased urination,Increased thirst,Urolithiasis,Stupor and Coma,,,,,,,
Mastitis ,both,common,Anorexia,LethargyNeglect of puppies or kittens,Failure of puppies or kittens to thrive,Firm,Swollen,Warm and painful,Fever,Dehydration and septic shock,Abscessation or gangrene of glands,,,,,,
Dermatoses-Exfoliative,both,common,dandruff or in sheets,dry accumulation,Scaling,Itchiness,Accumulations hair coat,Filling of hair follicles with oil and skin cells,Accumulation of debris around the hair shaft,Excess scales and crust on the nasal planum,Hair loss,Skin infections characterized,Rancid fat Odor,Nails may also be affected,,,
Shock-Cardiogenic,both,common,Rapid breathing,Severe shortness of breath,Sudden and rapid heartbeat,Loss of consciousness,Weak pulse,Low blood pressure,Sweating,Pale skin,Cold hands or feet,Urinating less,,,,,
Myeloproliferative Disorders ,both,common,Pale mucous membranes,Lethargy,Inappetance,Weight loss,HepatoSplenomegaly,ataxia,seizure,,,,,,,,
False Pregnancy,female,common,Swollen,painful muzzle,Swelling in wrists and lips which may feel hot,Reluctance to move,Pain in the abdomen,Vomiting,Diarrhea,Shallow breathing,obvious discomfort,Increased thirst,Frequent urination,Vomiting,Halitosis,Bad breath,Loss of Appetite
Baclofen Toxicosis ,both,common,Vomiting,Ataxia,Disorientation,Respiratory failure,Seizures,Drooling,Weakness,Hypothermia,Panting,Edema (pulmonary),Tremors,Dilated pupils,Slow heartbeat,,
Snake Venom Toxicosis?Pit Vipers,both,common,Visible bite marks,Pain,Swelling,Agitation,Breathing trouble,Vomiting,Diarrhea,Dizziness,Extreme sleepiness,Trouble walking,Fainting,Shock,Death,,
Vertebral Column Trauma ,both,common,ataxia,Clinical signs suggestive of hyperesthesia,Lethargy,Pulmonary contusions and rib fractures,Pelvic and appendicular bone fractures,Cutaneous wounds,Traumatic brain injury,Abdominal organ injury,,,,,,,
Myopathy - Noninflammatory - Metabolic ,both,common,Weakness,Exercise intolerance,Cramping,Collapse,Regurgitation,Esophageal and pharyngeal abnormalities,Dark urine,myoglobinuria,hemoglobinuria,Encephalopathy,Vomiting,Weakness,Stiffness,,
HemangiosarComa-Skin,both,common,Collapse,Depression,Difficulty breathing,Lack of appetite,Lethargy,Lumps on or directly under the skin,Pale mucous membranes,Shock,Ulcerated sores on skin,Visible Bleeding,Vomiting,Weakness,,,
Atrioventricular Block - First Degree,both,common,Light-headedness,muscular Weakness,loss of consciousness,Rapid heart rate,Fatigue,Lethargy,Slower heart rate,Heart failure,,,,,,,
Hyperlipidemia,both,common,Vomiting,Diarrhea,Abdominal discomfort or pain,Lesions,Pancreatitis,Creamy appearance of blood vessels,Yellowish plaques near the eyelids,Yellow or creamy fat deposits in the cornea,Nerve paralysis,Behavioral changes,Anemia,Seizures,,,
Neuroaxonal Dystrophy ,both,five,Cerebellar ataxia,progressive dysmetria,Strength and proprioception normal in most cases,exhibit proprioceptive deficits,Loss of menace responses,brainstem involvement,including loss of swallowing reflex,tetraplegia may develop in the final stages,Mild intention tremor,,,,,,
Pancytopenia,both,common,History reflects the underlying cause,Pallor,mucosal Bleeding,Repeated febrile,Weakness,Pale mucous membranes,Petechial Hemorrhages,Mucosal Hemorrhage,Fever,,,,,,
Hiatal Hernia,male,five,Regurgitation,Coughing,Nasal discharge,Hypersalivation,Weight loss,Shortness of breath,Lack of appetite,,,,,,,,
Hypomagnesemia,both,common,Weakness,Muscle trembling,Ataxia,Depression,Hyperreflexia,Severe muscle pain,Behavioral changes,Arrhythmias,,,,,,,
Maternal Behavior Problems ,female,common,Deficient Maternal Behavior,Absent maternal behavior,Abnormal Maternal Behavior,Maternal Aggression,Excessive Maternal Behavior,,,,,,,,,,
Dental Caries,both,common,Dark discoloration,Bad Odor and softened enamel and dentin,painful underlying tooth,lined by dark and soft necrotic dentin,,,,,,,,,,,
Lily Toxicosis,both,common,Vomiting,Depression,Vomiting,both persist throughout the syndrome,Polyuria and Dehydration,leads to anuric renal failure,Weakness,Recumbency by 2 to 4 days,,,,,,,
Cryptococcosis ,both,five,Lethargy,White eye,Neurologic,Seizures,ataxia,paresis,periorbital swelling,Blindness,Skin Ulceration,lymphadenopathy,Vomiting,,,,
Beta Blocker Toxicosis ,both,common,Bradycardia,Hypotension,AV block,Decreased mentation,Respiratory distress or bronchospasm,Seizures,Coma,,,,,,,,
Maxillary and Mandibular Fractures ,both,common,underlying risk factors resulting in the injury,Facial deformity,malocclusion,fractured teeth,oral or nasal Bleeding,inability to properly close the jaw,,,,,,,,,
Inflammatory Bowel Disease,both,five,Diarrhea,Weight loss,Fatigue,Depression,Vomiting,Gas,Abdominal pain,Rumbling and gurgling abdominal sounds,Bright red blood in stool,Distressed coat hair,,,,,
Constipation and Obstipation ,both,common,Straining to defecate with small or no fecal volume,Hard or dry feces,Infrequent defecation,Small amount of liquid and mucoid,stool,Tenesmus,Vomiting,inappetence and Lethargy,,,,,,,
Acral Lick Dermatitis,both,common,Excessive licking of the affected area,Lesions,Firm,,,,,,,,,,,,
Salmon Poisoning Disease,both,five,Vomiting,Diarrhea,Fever,Loss of Appetite,Lymph node,Weakness,Depression,Discharge from the eyes or nose,Dehydration,,,,,,
Iron Toxicosis,both,common,Vomiting,Pain and swelling in the abdomen,Loss of Appetite,Weight loss,Agitation,Fast heartbeat,Low blood pressure,Extreme tiredness,Shock,Seizure,Depression,Fever,Jaundice,Diarrhea,Muscle Tremors
Nasal and Nasopharyngeal Polyps ,both,common,Chronic,Noisy breathing,Nasal congestion or discharge,Sneezing,Unilateral,Generally non-responsive to antibiotics,Nasopharyngeal or Aural Polyps,Stridor,Gagging,Cyanosis,Voice change,Dysphagia,Chronic,ataxia,Head tilt
Cardiopulmonary Arrest ,both,common,Lack of response to stimulation,Loss of consciousness,Agonal gasping or absence of ventilation,Absence of peripheral pulses,Hypothermia,Absence of audible heart sounds,,,,,,,,,
Drowning,both,five,Labored or open-mouthed breathing,Apnea,Irregular breathing,Posture changes,Weak pulse,Loss of consciousness,Hypothermia,Cyanosis,changes in the color of mucous membranes,Pulmonary edema,fluid in the lungs,Acidosis,Coughing,Vomiting,
Splenic Torsion,both,common,Collapse,Abdominal pain,Vomiting,Lack of appetite,Swelling of the abdomen,Weight los,Increased drinking and urination,Urine color changes may look like port wine,Lethargy,Depression,,,,,
Cuterebriasis ,both,common,Dermatologic,warble containing bot,Neurologic,ataxia,circling,paralysis,Blindness,recumbency,Lesions,larva in conjunctiva,Respiratory,,,,
Anemia - Non Regenerative,female,common,Tachycardia,Pale mucous membranes,Abnormal peripheral pulses,Hypotension,Lethargy,Weakness,Anorexia,Splenomegaly,Abdominal distension,Heart murmur,Jaundice,Fever,Shock,,
Polyarthritis- Immune-Mediated,both,five,Lameness,Trauma,Vomiting,Diarrhea,Anorexia,Pyrexia,polyuria,polydypsia,Pacing,neoplastic disease,Stiffness,Decreased range of motion,Joint swelling,Joint instability,subluxation
Thymoma,both,fifteen,Difficulty swallowing,Exercise intolerance,Swelling of the face,,,,,,,,,,,,
Squamous Cell Carcinoma-Ear,both,common,crusty sores on the ears,Redness may come and go,Bleeding from sores on the ears,Sores on the ear that slowly get bigger,ear tips may disappear,ear may become malformed,sores on the face,,,,,,,,
Mycoplasmosis ,both,common,Polyarthritis,Lameness,Reluctance to move,Joint pain,Fever,Malaise,Unilateral,Polyarthritis,diffuse limb edema,Joint swelling,pain,Blepharospasm,Chemosis,Conjunctival hyperemia,red eye
Hypopyon,both,common,Pain,Eye rubbing,Whining,Eye discoloration,Swollen eyelids,Excessive Squinting,Excessive blinking,Eye twitching,Excessive tear production,Corneal swelling,Conjunctivitis,,,,
Hepatic Encephalopathy,both,common,Seizures,Hysteria,Pacing,Aggression,Staggering,Tremors,Walking in circles,Sudden Blindness,Diarrhea,Drooling,Weight loss,Sleepiness,Apathy,Compulsive behavior,Vomiting
Bile Duct Obstruction,both,ten,Weight loss,Severe Jaundice,Hepatomegaly unless biliary cirrhosis,Cranial mass effect structures,Vague cranial abdominal discomfort,Acholic feces unless enteric Bleeding,Bleeding tendencies,severe bilirubinuria,,,,,,,
Dermatoses-Sterile Nodular,both,five,Occasionally painful,Fever,Inappetence,Lethargy,Multiple lesions,,,,,,,,,,
Hypermetria and Dysmetria,both,common,Head tilt,Body swaying,Body Tremors,Wide leg stance,Loss of the menace response,Unequal pupil size,Abnormal movements,,,,,,,,
False Pregnancy,female,common,Swollen,painful muzzle,Swelling in wrists and lips which may feel hot,Reluctance to move,Pain in the abdomen,Vomiting,Diarrhea,Shallow breathing,obvious discomfort,Increased thirst,Frequent urination,Vomiting,Halitosis,Bad breath,Loss of Appetite
Coagulation Factor Deficiency ,both,common,Hematoma formation,Intracavitary Hemorrhage,Prolonged Hemorrhage post-surgery,Trauma,Blood loss anemia,,,,,,,,,,
Eclampsia,both,common,Weakness,Difficulty walking,Poor mothering,Restlessness,Nervousness,Panting,Whining,Vomiting,Diarrhea,Ataxia,Stiff gait,Limb pain,Facial pruritis,Muscle Tremors,Tetany
Sarcoptic Mange,both,common,Biting at the skin,Red and inflamed skin,scabs and crusty skin,open sores,hair loss,,,,,,,,,,
Q Fever,both,common,Fever,Lethargy,Anorexia,Depression,Incoordination,Seizures,Miscarriage,,,,,,,,
Grape Raisin and Currant Toxicosis,both,common,Vomiting,Diarrhea,Grapes or raisins in vomit or stool,Low energy,Loss of Appetite,Weakness,Abdominal pain,Excessive thirst,Lack of urine production,Tremors,,,,,
Chocolate Toxicosis ,both,common,Ingestion,chewed containers,Vomiting,increased activity,,,,,,,,,,,
Adenocarcinoma - Pancreas,both,ten,fever,Vomiting,Weakness,Anorexia,Icterus,malabsorption syndrome,Weight loss,Abdominal pain,Abdominal effusion,,,,,,
Lumbosacral Stenosis and Cauda Equina Syndrome ,both,five,Lumbosacral pain,reluctance to jump,Pain on pressure,induced during extension of hip joints,Lameness,Abnormal tail carriage,Weakness,results from dysfunction of caudal nerves,Self-inflicted lesions,,,,,,
Fiber-Responsive Large Bowel Diarrhea,both,common,Hematochezia,Excess fecal mucus,Tenesmus,Abdominal pain,Vomiting,,,,,,,,,,
