Helicobacter spp,both,common,Vomiting,Dehydration,Poor appetite,Bowel sounds,Abdominal pain,Weight loss,Diarrhea,Weakness,Sudden death,,,,,,
Breeding - Timing,male,common,color during estrus,vulvar edema of proestrus decreases,receptive to male during estrus,ulva less turgid,Vaginal discharge-less color and amount,Flagging,Fully cornified and crenulated,pale vaginal epithelium,,,,,,,
Hypomyelination,both,ten,Inability to walk or stand,Incoordination,Shaking,Tremors that worsen with activity,Difficulty running or jumping,Lameness,Incontinence,Lack of coordination,Muscle wasting,Odd gait,Partial paralysis,Sores on top of the feet,,,
Cardiomyopathy-Boxer,both,five,ventricular premature complexes,Syncope,Signs of left heart failure,Coughing,tachypnea,biventricular failure with VPCs,Fever,,,,,,,,
Pyometra,female,common,Dogs present within 12 weeks after their last estrus,exogenous hormones,Uterus with closed cervix palpably enlarged,palpate carefully to avoid rupture,with open cervix may not be palpably enlarged,Systemic illness,Open cervix blood-stained,purulent vaginal discharge often only presentation,Closed cervix,polyuria,Polydipsia,Lethargy,Anorexia,Vomiting,Abdominal distension
Retinal Hemorrhage,both,common,Acute or progressive Vision loss,Symmetrical,Bleeding inside the eyes,Bleeding from the eyes,Dilated pupils,Enlarged eyes,Greenish,shiny reflection of the eyes,Red eyes,,,,,,
Rhinosporidiosis,male,common,Sneezing,Bleeding,Wheezing,Labored breathing,an infection of the nostrils with a cauliflower-like growth,a polyp or other growth located near or on the nostril,,,,,,,,,
Canine Parvovirus Infection ,both,common,Diarrhea,Anorexia,Vomiting,Weight loss,shock-like state,In breeding kennels,several littermate pups,minimal,Dehydration,abdominal discomfort,Often there is severe hemorrhagic diarrhean,Fluid-filled intestinal,Vomiting,fever,
Lupus Erythematosus - Systemic,male,common,Lethargy,Anorexia,Lameness,Lesions,Fever,Weakness,sequential rather than concurrent,Swollen,painful joints,Swollen but not deformed,Lesions,Erythema,Scaling,Ulceration,Depigmentation
Deciduous Teeth-Persistent,both,five,Bad breath,Abnormally-positioned permanent teeth,Swollen,Bleeding gums around baby teeth,teeth overcrowding,passageway mouth and nasal cavity,,,,,,,,,
Vaginal Discharge ,both,common,Discharge from the vulva,Licking,Scooting,Postpartum,Recent estrus with pyometra,Hemorrhagic discharge,Vomiting,Vaginal discharge that may be serosanguinous,purulent,lochial,hemorrhagic,mucoid or urinous,,,
Vasculitis - Systemic ,both,common,Provocative drug given to sensitized animal,Recent vaccination history,Exposure to ticks,Poor dirofilariasis prophylaxis,Swelling,Ulceration,Necrosis of affected skin especially mucous membranes,mucocutaneous junctions,pinnae edges and footpads,reflecting organ involvement,Systemic signs of illness,lymphadenopathy,Pyrexia,vague signs of pain,fever
Polypoid Cystitis,both,common,Hematuria is the most common sign,Gross Hematuria,Dysuria,Urethral obstruction,Polyps originating,surround the ureteral orifice,Urinary tract infection,,,,,,,,
Hypokalemia,both,common,Vomiting,Lethargy,Frequent urination and thirst,Chronic,Stiff gait,Plantigrade,Loss of weight,Loss of muscle mass,Ventroflexion of the head,Cardiac arrhythmia,,,,,
Zinc Toxicosis ,both,common,Anorexia,Vomiting,Diarrhea,Lethargy,Pale or icteric mucous membranes,Hemoglobinemia,Hemoglobinuria,Orange-tinged feces,Tachycardia,,,,,,
Patellar Luxation,both,common,limbing,Occasional skipping,Lameness,patella,patella can be manually displaced,extends the stifle joint,Patient intermittently carries,patella remains luxated most of the time,reluxation of the patella,patella is permanently luxated,shallow or missing femoral trochlea,crouching,bowlegged,Lameness,Pain
Sinus Tachycardia,both,common,Shortness of breath,Dizziness or feeling lightheaded,Confusion,Weakness,Chest pain from angina,Collapse,Fever,Blood clots,Heart attack,,,,,,
Patent Ductus Arteriosus,female,common,Respiratory,Coughing,CHF,Stunted growth in some,rear limb Weakness,Signs usually precipitated by or worsened by exercise,machinery-type murmur loudest,murmur can be loud near the manubrium sterni,systolic murmur,resemble arlong systolic and early diastolic murmur,Loud murmurs,Arterial pulses,,,
"ChondrosarComa, Bone ",both,common,visible mass at the affected site,Lameness,visible body wall anomaly,Fever,,,,,,,,,,,
Tapeworms,both,common,Weight loss,Lethargy,Distended abdomen,Vomiting,Diarrhea,Dull coat,Visual evidence of tapeworms,,,,,,,,
Spinal Dysraphism,both,common,Abnormal spinal reflexes,Symmetrical,Wide legged stance,Overextended pelvic limbs,Depressed proprioception,Scoliosis,Abnormal hair streams,Depression,,,,,,,
Hyperosmolarity,both,common,Lethargy,Vomiting,Weakness,Lack of appetite,Increased urination,Increased thirst,Urolithiasis,Stupor and Coma,,,,,,,
Urolithiasis - Cystine ,female,common,number of uroliths,May be Asymptomatic,Pollakiuria,Dysuria and Hematuria,Pollakiuria,voiding of small smooth uroliths,Complete outflow obstruction,Nephroliths typically Asymptomatic,hydronephrosis and renal insufficiency,,,,,,
Corneal and Scleral Lacerations ,both,common,Varies with tissues affected,corneal,scleral,eyelid deformity,edema,Hemorrhage,May see a retained foreign body,Often rapidly seals,subconjunctival hematoma,May also see iris defects,pupil distortion,Hyphema,cataract,vitreal Hemorrhage,Dilated pupils
Pododermatitis,male,common,Environment and general husbandry,unsanitary conditions,Trauma,contact irritants,hookworms,atopic dermatitis,allergic contact dermatitis or irritant contact dermatitis,Lesions,Lesions,illness,Response to previous therapy,antibiotics,antifungals and corticosteroids,Infectious,Erythema
Dermatomyositis,both,five,Lesions,Lesions,Lesions,tip of tail or pressure points,Muscle atrophy,Weakness,Mega-esophagus,,,,,,,,
"ChondrosarComa, Bone ",both,common,visible mass at the affected site,Lameness,visible body wall anomaly,Fever,,,,,,,,,,,
Hepatitis-Suppurative and Hepatic Abscess,both,common,Appetite loss,Vomiting,Diarrhea,Dark urine,Weight loss,Lethargy,Increased urination,Increased thirst,Abdominal pain,Yellowish discoloration of the skin,Distended abdomen,Fever,Skin disorders,Mouth ulcers,Lesion in the nose
Hyponatremia,both,common,Lack of energy,Vomiting,Seizures,Less alert,Disorientation,Loss of Appetite,Lowered muscle strength,,,,,,,,
Atherosclerosis ,male,five,Lethargy,Anorexia,Weakness,Dyspnea,Collapse,Vomiting,Diarrhea,,,,,,,,
Ureterolithiasis ,both,common,May be initially Asymptomatic,ureteral obstruction,hydronephrosis,Unilateral,lower urinary,Ureteral rupture,,,,,,,,,
Sinus Tachycardia,both,common,Shortness of breath,Dizziness or feeling lightheaded,Confusion,Weakness,Chest pain from angina,Collapse,Fever,Blood clots,Heart attack,,,,,,
Panting and Tachypnea,both,common,Coughing,hyperadrenocorticism,intermittent,Brachycephalic syndrome may be observed,Stridor,Lower airway disease,Coughing,expiratory wheezes on auscultation,abdominal effort,crackles on auscultation,harsh or moist lung sounds,Cardiogenic pulmonary edema,heart murmur or arrhythmia,Tachycardia,gallop sound
Campylobacteriosis ,both,ten,Diarrhea,bile streaked,Tenesmus,Fever,Anorexia,Vomiting,,,,,,,,,
Pneumonia- Bacterial,male,common,Coughing,Labored breathing,Exercise intolerance,Weight loss,Lethargy,Nasal discharge,Fever,Difficult or rapid breathing,Abnormal breath sounds,crackles and wheezes,Weight loss,Nasal discharge,Lethargy,Dehydration,
Renal Tubular Acidosis,both,common,Weakness,inappetence,Weight loss,Stunted growth,Vomiting,,,,,,,,,,
Hyperlipidemia,both,common,Vomiting,Diarrhea,Abdominal discomfort or pain,Lesions,Pancreatitis,Creamy appearance of blood vessels,Yellowish plaques near the eyelids,Yellow or creamy fat deposits in the cornea,Nerve paralysis,Behavioral changes,Anemia,Seizures,,,
Nail and Nailbed Disorders ,both,five,Licking at the feet or ungual folds,Lameness,Pain,Swelling,Erythema,exudate of ungual fold,Deformity,sloughing of nail,Discoloration of the nail,loss of a nail,,,,,
Sinus Arrhythmia,both,common,Fast heartbeat,Slow heartbeat,Fainting,Breathing trouble,Coughing,Fatigue,Dizziness,Weakness,,,,,,,
HemangiosarComa-Skin,both,common,Collapse,Depression,Difficulty breathing,Lack of appetite,Lethargy,Lumps on or directly under the skin,Pale mucous membranes,Shock,Ulcerated sores on skin,Visible Bleeding,Vomiting,Weakness,,,
Ductal Plate Malformation,both,five,Gastrointestinal signs,Poor body condition,Abdominal effusion,Diarrhea,Fever,Choledochal cyst,,,,,,,,,
Congenital Spinal and Vertebral Malformations ,both,five,Distortion of the spinal column,Lordosis,kyphosis,Ataxia,Signs vary with spinal cord segment involved,,,,,,,,,,
Vaginal Hyperplasia and Prolapse ,both,five,Onset of proestrus or estrus,parturition,Licking of vulvar area,Failure to allow copulation,Dysuria,Previous occurrence,Protrusion of round,tongue-shaped or donut-shaped tissue mass,Vaginal examination ocate lumen and urethral orifice,Tissue may be dry or necrotic.,,,,,
Corneal Opacities - Degenerations and Infiltrates ,both,common,associated ocular or systemic disorders,Lipid,gray white or crystalline,can be band-shaped or irregular or circular,Calcium dense white to crystalline regular,superficial stroma,keratitis or Uveitis,Corneal vascularization,edema and pigmentation often present,With progression the cornea,,,,,
Hypomyelination,both,ten,Inability to walk or stand,Incoordination,Shaking,Tremors that worsen with activity,Difficulty running or jumping,Lameness,Incontinence,Lack of coordination,Muscle wasting,Odd gait,Partial paralysis,Sores on top of the feet,,,
Pneumonia-Aspiration,both,common,Peracute,Chronic,Coughing,tachypnea,Exercise intolerance,Cyanosis,Regurgitation,Vomiting,dysphagia,altered consciousness,stertor or stridor,,,,
Uterine Inertia ,both,common,failure of gestation,Asymptomatic except,fetal heart rates decline with delay in intervention,contractions cease despite,may deliver part of litter and then stop,fetal heart rates decline with delay in intervention,,,,,,,,,
Infertility-female,female,ten,False pregnancy due to an ovarian cyst,Metabolic hypothyroidism,Uterine infections,Increased swelling of vulva,Decreased Bleeding,Irregular ovarian cycles,Split heats,Hypoluteoidism,Failure to cycle,Refusal to breed,,,,,
Perianal Fistula,both,ten,Dyschezia,Tenesmus,Hematochezia,Constipation,Diarrhea,MalOdorous,Ulceration of the perianal skin with sinus tract formation,Licking and self-mutilation,Reluctance to sit,posturing difficulties,personality changes,Pain on manipulation perianal area,Fecal incontinence,Anorexia,Weight loss
Antidepressant Toxicosis?Tricyclic,both,common,Depression,Tachycardia,Mydriasis,Hypothermia,Hypertension,Pallor,Cyanosis,Hyperthermia,Arrhythmias,Hypotensionn,Urinary retention,Constipation,,,
Eyelash Disorders,both,common,Change in iris pigmentation,Excessive tears,Abnormal ticking or twitching of the eyelid,Corneal ulcers,Pawing at eye,Eye pain,Inflammation,Discharge from eye,,,,,,,
Hypomyelination,both,ten,Inability to walk or stand,Incoordination,Shaking,Tremors that worsen with activity,Difficulty running or jumping,Lameness,Incontinence,Lack of coordination,Muscle wasting,Odd gait,Partial paralysis,Sores on top of the feet,,,
Ovulatory Failure,female,ten,Difficulty getting pregnant,Hot flashes,Night sweats,Vaginal dryness,Dry eyes,Irritability or difficulty concentrating,Decreased sexual desire,,,,,,,,
Esophagitis,both,common,Pain in the neck or throat,Coughing,Difficulty swallowing,Increasing attempts to swallow,Signs of pain while swallowing food,Drooling,Vomiting,Loss of Appetite,Weight loss,Abnormal posture or movements,Refusing to lie down,Fever,,,
Melanocytic Tumors - Skin and Digit ,both,common,Skin mass with variable growth rates,Solitary,Lameness,Lymph node,diffuse pulmonary metastasis,,,,,,,,,,
Blind Quiet Eye ,both,ten,Bumping into things,Unwillingness,Unresponsive to movements,around the house,Bumping into objects,Clumsy behavior,Reluctance to move,Impaired vision in dim light,,,,,,,
Digoxin Toxicity,both,common,Depression,Lack of appetite,Vomiting,Diarrhea,Lethargy,,,,,,,,,,
Hypermagnesemia,both,common,Nausea,Vomiting,Weakness,Lowered heart rate,Paralysis,Depression,Poor reflexes,Depression,Cardiac arrest,Coma,,,,,
Pericarditis,both,fifteen,tamponade,Collapse,Weakness,Anorexia,high central venous pressure,noticeable weakening,muffled or distant heart sounds,Ascites prominent among them,chronically elevated central venous pressures,,,,,,
Canine Infectious Respiratory Disease ,both,ten,respiratory tract damage,Can be subclinical,mild or severe with pneumonia,Most viral,mycoplasmal,the infecting agents,Coughing,dry and hacking,,,,,,,
Hypernatremia,both,common,Extreme thirst,Excessive urination,Weakness,Sleepiness,Confused and disoriented,Depression,Walking in circles,Head pressing,Twitching or trembling muscles,Vomiting,Diarrhea,Swollen belly,Seizures,Coma,
Ceruminous Gland Adenocarcinoma - Ear ,both,ten,Chronic,recurrent otitis externa,discharge,Odor,Pruritus,inflammation,pale pink,friable,ulcerative,Bleeding nodular mass,large masses filling the canal,node enlargement,Neurologic,discomfort,Mouth pain
Lymphedema ,both,common,peripheral limb swelling,Swelling,Unilateral,Pitting,temperature of affected area is normal,Pitting quality lost with chronicity as fibrosis occurs,Lameness,,,,,,,,
Coagulation Factor Deficiency ,both,common,Hematoma formation,Intracavitary Hemorrhage,Prolonged Hemorrhage post-surgery,Trauma,Blood loss anemia,,,,,,,,,,
Lens Luxation ,both,five,Lens instability and subluxation,fibrils of liquefied vitreous,abnormally shallow or deep anterior chamberm,abnormal iris curvature,phacodenesis,iridonesis,aphakic crescent,Lens luxation,anterior,posterior,Can have same signs as lens subluxation,chronically painful eye,,,
Urolithiasis - Cystine ,female,common,number of uroliths,May be Asymptomatic,Pollakiuria,Dysuria and Hematuria,Pollakiuria,voiding of small smooth uroliths,Complete outflow obstruction,Nephroliths typically Asymptomatic,hydronephrosis and renal insufficiency,,,,,,
FibrosarComa Gingiva,both,common,Oral Bleeding,Traces of blood in saliva,Difficulty chewing and eating,Difficulty swallowing,Lymph node,Drooling,Facial swelling,Growth or growths in mouth,Persistent Halitosis,Unexplained weight loss,,,,,
Heartworm Disease,male,five,Persistent Coughing,Reluctance to exercise,Fatigue after moderate activity,Decreased appetite,Weight loss,Swollen belly,,,,,,,,,
Pyothorax,male,common,fever,Vomiting,Diminished activity,Collapse,Weight loss,Temporary improvement with antibiotic therapy,Firm,Tachypnea,may be mild and not associated with respiratory difficulty,Cachexia,Coughing,Pyrexia,Thoracic auscultation,may reveal muffled heart sounds,reduce breath sound
Hypoadrenocorticism ,female,common,Depression,Lethargy,Lack of appetite,Weight loss,Vomiting,Diarrhea,Bloody,Hair loss,Increased urination,Increased thirst,Dehydration,Shaking,Weak pulse,Irregular heart rate,Low temperature
Vaginal Malformations and Acquired Lesions ,female,common,Vulvar discharge,Excessive licking of vulva,Frequent or inappropriate urination,Stranguria or dyschezia,Urinary,incontinence,Attractive to males,Refuses mating,Mass at vulvar labia,Evidence of vaginal discharge,Recessed or hypoplastic vulva occasionally,,,,
Microsporidiosis ,both,common,Postpartum,Stunted growth,Ill-thrift,Depression,Weight loss,Nephritis progressing to renal failure,Neurologic abnormalities,Convulsions,viciousness,Biting,Vocalization,ataxia,circling,Hypermetria,White eye
Renal Failure-Chronic ,both,ten,Anorexia,Lethargy,Vomiting,Weight loss,Nocturia,Constipation,Diarrhea,Acute Blindness,Seizures,,,,,,
Bronchiectasis ,both,ten,Chronic,hemoptysis,Fever,Exercise intolerance,Tachypnea,Chronic,particularly with primary ciliary dyskinesia,Moist,harsh inspiratory crackles,loud expiratory lung sounds,Tracheal hypersensitivity,,,,
Separation Distress Syndrome,both,common,Urinating and Defecating,Barking and Howling,Chewing,Digging and Destruction,Escaping,Pacing,Coprophagia,Change in Schedule,,,,,,,
Lymphedema ,both,common,peripheral limb swelling,Swelling,Unilateral,Pitting,temperature of affected area is normal,Pitting quality lost with chronicity as fibrosis occurs,Lameness,,,,,,,,
Protein-Losing Enteropathy,both,common,Diarrhea,weight loss,dogs with PLE have normal stools.,weight gain,Ascites,dependent edema,Abdominal palpation may reveal thickened bowel loops,,,,,,,,
Pyelonephritis,both,common,Maybe Asymptomatic,Polyuria or Polydipsia,Abdominal or lumbar pain,Signs associated with lower urinary tract,infection,Dysuria,Pollakiuria,periuria Stranguria,MalOdorous,Pain upon palpation of kidneys,Fever,,,,
Ophthalmia Neonatorum ,both,common,Swollen eyelids,Red eyes,outward bulge,lost vision,Collapse,corneal adhesions,uicerated cornea,perforated cornea,mucoid discharge from eyelids,,,,,,
Coonhound Paralysis ,both,common,Appear 7?14 days after contact with raccoon saliva,bite or scratch,receipt of a vaccination,gastrointestinal infection,Initial signs,stiff,stilted gait in all limbs,typically starting in the pelvic limbs,Rapid progression (2?4 days) to a flaccid,ower motor neuron tetraparesis to tetraplegia,loss or change of voice,water consumption,Urination,Blindness,
Adenocarcinoma - Salivary Gland ,both,ten,Unilateral,Firm,swelling,Halitosis,Weight loss,Anorexia,dysphagia exophthalmus,Horner?s syndrome,Sneezing,dysphonia,,,,,
Urolithiasis - Xanthine ,both,common,number of uroliths,Pollakiuria,Dysuria,voiding of small,Complete outflow obstruction may result in azotemia,May be Asymptomatic,hydronephrosis and renal insufficiency,,,,,,,,
Traumatic Myocarditis,both,common,Fast heartbeat,Slow heartbeat,Heart murmur,Irregular breathing,Rapid breathing,Coughing,Fainting,Weakness,Vomiting,Loss of Appetite,Weight loss,,,,
Brain Tumors ,both,ten,Seizures,Abnormal behavior,Vision loss,Food and Water Intake Changes,Neck or Head Pain,Restless,Unsteady,Nausea,,,,,,,
Degenerative Myelopathy,both,ten,Swaying in the hind end when standing,Easily falls over if pushed,Wobbling,Knuckling of the paws when trying to walk,Feet scraping on the ground when walking,Abnormally worn toenails,Difficulty walking,Difficulty getting up from a sitting,Falling down when walking or standing,Inability to walk,Paralysis of the hind limbs,Difficulty with swallowing and tongue movements,Urinary and fecal incontinence,limbs,
Elbow Dysplasia,male,five,Limping,Stiffness,Less enthusiasm to go for walks or play,elbows held at a strange angle,Swollen and puffy elbows,Pain,,,,,,,,,
"Epilepsy, Genetic",male,five,collapsing,jerking,stiffening,Muscle twitching,loss of consciousness,Drooling,chomping,tongue chewing or foaming at the mouth,,,,,,,
Pneumonia- Bacterial,male,common,Coughing,Labored breathing,Exercise intolerance,Weight loss,Lethargy,Nasal discharge,Fever,Difficult or rapid breathing,Abnormal breath sounds,crackles and wheezes,Weight loss,Nasal discharge,Lethargy,Dehydration,
Respiratory Parasites,both,common,Coughing,Wheezing,Weight loss,Increased breathing rate,Sneezing,Nasal discharge,Weakness,Vomiting,Lethargy,Regurgitation,Aspiration of food or stomach contents,Worms present in feces,,,
Adenocarcinoma - Nasal,both,ten,Sneezing,Anorexia,Seizures,Nasal discharge,Facial deformity,Pain in the nose,Obstructive masses in the animal's nose,,,,,,,,
Dioctophyma renale,both,common,Back pain,Inflammation,Abdominal pain,Fever,Weight loss,,,,,,,,,,
Bile Peritonitis ,both,common,Lethargy,Abdominal pain,Jaundice,Abdominal effusion,Fever,Endotoxic shock,Abdominal discomfort,Anorexia,Diarrhea,Weight loss,Abdominal distention,Collapse,,,
Aortic Stenosis,both,five,Arrhythmias may be ausculted,Pulse deficits,Weak pulses,Tachypnea,Respiratory distress,Systolic left basilar ejection murmur,,,,,,,,,
HemangiosarComa-Heart,male,ten,Fainting,Weakness,Lethargy,Lack of appetite,Vomiting,Coughing,Collapse,,,,,,,,
Ureterolithiasis ,both,common,May be initially Asymptomatic,ureteral obstruction,hydronephrosis,Unilateral,lower urinary,Ureteral rupture,,,,,,,,,
Hypoalbuminemia,both,five,Abdominal distention,Diarrhea,Vomiting,Difficulty breathing,Swollen limbs,Generalized swelling,,,,,,,,,
Horner?s Syndrome,both,common,Drooping of the eyelid,Constricted pupil of the affected eye,Sunken appearance of the affected eye,third eyelid,Vision may be impaired,,,,,,,,,,
Lymphangiectasia ,both,fifteen,Diarrhea,Chronic,intermittent or continuous watery to semisolid consistency,Ascites,Subcutaneous edema,Pleural effusion,Weight loss,Flatulence,Vomiting,,,,,,
Tetralogy of Fallot,both,common,Weakness,Dyspnea or shortness of breath,Exercise intolerance,Slower rate of growth than littermates,Fainting,Seizures,Cyanosis,,,,,,,,
Hypoparathyroidism,female,common,Tingling sensation,Twitching facial muscles,Muscle pains,Tiredness,Dry and rough skin,Coarse hair that breaks easily and can fall out,Fingernails that break easily,,,,,,,,
Squamous Cell Carcinoma-Digit,both,five,Raised wart like lump,Inflamed sores,Bleeding sores,Limping or signs of pain when walking,Lameness,Drooling,Difficulty chewing or swallowing,Mild Coughing,Swollen or inflamed areas in the mouth,Loose teeth,Oral Bleeding,,,,
Puppy Strangles ,both,common,Acutely Swollen face,Submandibular lymphadenopathy,Purulent otitis externa,Lesions,Affected skin is usually painful,Lethargy,Anorexia,Pyrexia and sterile suppurative arthritis,Sterile pyogranulomatous panniculitis over the trunk,preputial or perianal area,Lesions,,,,
Hypocalcemia,both,common,Muscle twitching and trembling,Uncoordinated or stiff gait,Panting,Face rubbing against objects,Vomiting,Lack of appetite,Fever,Weakness,,,,,,,
Lipoma ,female,ten,multiple Lipomas,Variable size amd shape and growth rate,Asymptomatic unless,Lipomas,abdominal cavity,Lipomas,intermuscular Lipomas,,,,,,,,
Temporomandibular Joint Disorders,both,common,Unable to open or close mouth,Clicking noise,Swelling,Drooling,Deformed mouth or face,Whining when eating,Inability to eat,Visible pain when opening mouth,Appetite loss,Extreme loss of weight,,,,,
Adderall Toxicity,both,common,Drooling,Vomiting,Diarrhea,Panting,Agitation,Aggression,Sedation,Hypertension,Tremors,Seizures,Elevated heart rate,,,,
Ventricular Tachycardia ,both,common,Syncope,Weakness,Exercise intolerance,Sudden death,May be Asymptomatic,arrhythmia is paroxysmal,Tachycardia,Femoral pulses,arrhythmia,,,,,,
Strongyloidiasis,both,common,Diarrhea,Diarrhea,Weight loss,Reduced growth in puppies,Pneumonia in puppies,Weakness,Lack of appetite,Intestinal inflammation,Fever,Shallow rapid breathing,,,,,
Keratitis - Ulcerative ,both,ten,Chronic,Tearing,Squinting,Rubbing at eyes,Owners may report the appearance of a film,over the eye,prolapsed third eyelid,,,,,,,,
Tooth Fracture,both,common,Chewing on one side,Dropping food,Drooling,Grinding of teeth,Pawing at the mout,Facial swelling,Lymph node,Shying away when the face is petted,,,,,,,
Brachycephalic Airway Syndrome ,both,five,Snoring,stridor,stertorous breathing,Tachypnea,Panting,Coughing,Difficulty eating and swallowing,Ptyalism,Regurgitation,Vomiting,Syncope and episodes of collapse,,,,
Oliguria and Anuria ,female,common,Decrease in development of urine,Dehydration,shock,Vomiting,lethary,Loss of Appetite,Weight loss,weak pulse,,,,,,,
Lily Toxicosis,both,common,Vomiting,Depression,Vomiting,both persist throughout the syndrome,Polyuria and Dehydration,leads to anuric renal failure,Weakness,Recumbency by 2 to 4 days,,,,,,,
Lysosomal Storage Diseases ,both,common,,Vary with severity of the enzyme deficiency,predominate,Affected animals are normal at birth,mucopolysaccharidoses,Neurologic,,,,,,,,,
Sinus Tachycardia,both,common,Shortness of breath,Dizziness or feeling lightheaded,Confusion,Weakness,Chest pain from angina,Collapse,Fever,Blood clots,Heart attack,,,,,,
Chediak-Higashi Syndrome ,both,common,Red fundic reflex,lack of choroidal pigment,yellow-green irises,epiphora in bright light,,,,,,,,,,,
Traumatic Myocarditis,both,common,Fast heartbeat,Slow heartbeat,Heart murmur,Irregular breathing,Rapid breathing,Coughing,Fainting,Weakness,Vomiting,Loss of Appetite,Weight loss,,,,
Pneumonia-Fungal,both,five,Weight loss,OculoNasal discharge,Coughing,Tachypnea,Blepharospasm,Papules and cutaneous nodules,Lameness,Seizures,ataxia,behavior change if CNS affected,Emaciation,Harsh,loud breath sounds,Coughing on tracheal palpation,Dyspnea
Cholecystitis and Choledochitis,both,common,Choledochitis,vague signs,variable Icterus,Sudden onset,inappetence,Lethargy,Vomiting,Abdominal pain,fever,Chronic,shock due to endotoxemia,bacteremia,hypovolemia,Depression,
Uterine Inertia ,both,common,failure of gestation,Asymptomatic except,fetal heart rates decline with delay in intervention,contractions cease despite,may deliver part of litter and then stop,fetal heart rates decline with delay in intervention,,,,,,,,,
Paraneoplastic Syndromes,both,common,muscle pain,Alopecia,Anemia,Cachexia,Cutaneous flushing,Diencephalic syndrome,Disseminated,intravascular coagulation,Eosinophilia,Gastroduodenal Ulceration,Hypercalcemia,Hypertrophic osteopathy,Hypoglycemia,Myelofibrosis,Bleeding
Cervical Spondylomyelopathy,both,five,Chronic,slowly progressive gait,Neck Pain,acute worsening,Neck Pain,illness,,,,,,,,,
Gastroenteritis Lymphocytic-Plasmacytic,both,five,Diarrhea,Vomiting,Appetite loss,Weight loss,Black stool,Bloody,Coughing,Lethargy,Swelling of the abdomen,Breathing trouble,Fluid retention,,,,
Anemia of Chronic Kidney Disease,both,common,Weight loss,Poor appetite,Lethargy,Lack of stamina,Weakness,Rapid heart rate,Rapid breathing,Paleness of mucus membranes,Blood in the stool,Excessive drinking and urination,,,,,
Hydronephrosis,both,common,Loss of Appetite,Restlessness,Excessive thirst and urination,Blood in urine,Signs of uremia,Bad breath,Mouth sores,Vomiting,Abdominal pain,Lower Back pain,Abdominal distention,,,,
